{
  "id": "ufo-terminal-dome",
  "type": "venue",
  "title": "UFO Terminal Dome",
  "location": "Shanghai",
  "summary": "A dome-like spatial presentation environment used for immersive audiovisual testing and presentation.",
  "screen": {
    "shape": "dome",
    "resolution": "15456x2184",
    "frameRate": "60fps"
  },
  "relatedWorks": [
    "drop-flow"
  ]
}
